{"argv":["curl","--config","missing.conf"],"curlSourceVersion":"8.20.0","diagnostics":[],"errors":[{"code":"E_PARSE_HOST_DEPENDENCY_UNSUPPORTED","detail":"option requires host-dependent curl CLI behavior","option":"--config","warning":false}],"events":[{"argvIndex":1,"canonical":"config","isNext":false,"isPositional":false,"negated":false,"operation":0,"rawFlag":"--config","usedNextArg":true,"value":"missing.conf","valueArgvIndex":2}],"ir":{"command":{"argv":["curl","--config","missing.conf"],"inputMode":"argv"},"curlSourceVersion":"8.20.0","diagnostics":[],"externalRefs":[],"globals":{},"groups":[{"id":"group-0","index":0,"options":{"headers":[]},"transfers":[]}],"runtime":{"profile":{"compile":{"availableOptions":null,"defines":[],"disabledOptions":[]},"curlVersion":"8.20.0","defaults":{"followRedirects":false,"httpVersion":null,"userAgent":null},"features":["alt-svc","AsynchDNS","brotli","GSS-API","HSTS","HTTP2","HTTP3","HTTPS-proxy","IDN","IPv6","Kerberos","Largefile","libz","PSL","SPNEGO","SSL","threadsafe","TLS-SRP","UnixSockets","zstd"],"http3Backend":"ngtcp2","optionCatalog":{"curlVersion":"8.20.0","sha256":"413ecc7f3a2639a99e1f5a9dc5e121145c8a48777a7c2464cce3fca2694e0ae3","source":"build/generated/options-8.20.0.json"},"protocols":["dict","file","ftp","ftps","gopher","gophers","http","https","imap","imaps","ipfs","ipns","mqtt","mqtts","pop3","pop3s","rtsp","scp","sftp","smtp","smtps","telnet","tftp"],"resolverBackend":"c-ares","schemaVersion":"curl-runtime-profile/v1","sslBackend":"openssl"}},"schemaVersion":"curl-ir/v1"},"ok":false,"operations":[],"runtimeProfileApplied":{"compile":{"availableOptions":null,"defines":[],"disabledOptions":[]},"curlVersion":"8.20.0","defaults":{"followRedirects":false,"httpVersion":null,"userAgent":null},"features":["alt-svc","AsynchDNS","brotli","GSS-API","HSTS","HTTP2","HTTP3","HTTPS-proxy","IDN","IPv6","Kerberos","Largefile","libz","PSL","SPNEGO","SSL","threadsafe","TLS-SRP","UnixSockets","zstd"],"http3Backend":"ngtcp2","optionCatalog":{"curlVersion":"8.20.0","sha256":"413ecc7f3a2639a99e1f5a9dc5e121145c8a48777a7c2464cce3fca2694e0ae3","source":"build/generated/options-8.20.0.json"},"protocols":["dict","file","ftp","ftps","gopher","gophers","http","https","imap","imaps","ipfs","ipns","mqtt","mqtts","pop3","pop3s","rtsp","scp","sftp","smtp","smtps","telnet","tftp"],"resolverBackend":"c-ares","schemaVersion":"curl-runtime-profile/v1","sslBackend":"openssl"},"schemaVersion":"curl-parse-output/v1"}
