{"argv":["curl","--data","@secret.txt","https://example.com"],"curlSourceVersion":"8.20.0","diagnostics":[],"errors":[],"events":[{"argvIndex":1,"canonical":"data","isNext":false,"isPositional":false,"negated":false,"operation":0,"rawFlag":"--data","usedNextArg":true,"value":"@secret.txt","valueArgvIndex":2},{"argvIndex":3,"canonical":null,"isNext":false,"isPositional":true,"negated":false,"operation":0,"rawFlag":"https://example.com","usedNextArg":false,"value":"https://example.com","valueArgvIndex":3}],"ir":{"command":{"argv":["curl","--data","@secret.txt","https://example.com"],"inputMode":"argv"},"curlSourceVersion":"8.20.0","diagnostics":[],"externalRefs":[{"access":"read","id":"external-0","kind":"file","option":"--data","source":{"argvIndex":2,"end":11,"source":"argv","start":0},"value":"secret.txt"}],"globals":{},"groups":[{"id":"group-0","index":0,"options":{"headers":[]},"transfers":[{"effective":{"auth":{},"body":{"externalRefId":"external-0","kind":"data","source":{"argvIndex":2,"end":11,"source":"argv","start":0},"value":"@secret.txt"},"cookies":[],"headers":[],"httpVersion":null,"method":{"source":"body","sourceSpan":{"argvIndex":2,"end":11,"source":"argv","start":0},"value":"POST"},"proxy":null,"tls":{}},"id":"transfer-0","index":0,"source":{"argvIndex":3,"end":19,"source":"argv","start":0},"url":"https://example.com"}]}],"runtime":{"profile":{"compile":{"availableOptions":null,"defines":[],"disabledOptions":[]},"curlVersion":"8.20.0","defaults":{"followRedirects":false,"httpVersion":null,"userAgent":null},"features":["alt-svc","AsynchDNS","brotli","GSS-API","HSTS","HTTP2","HTTP3","HTTPS-proxy","IDN","IPv6","Kerberos","Largefile","libz","PSL","SPNEGO","SSL","threadsafe","TLS-SRP","UnixSockets","zstd"],"http3Backend":"ngtcp2","optionCatalog":{"curlVersion":"8.20.0","sha256":"413ecc7f3a2639a99e1f5a9dc5e121145c8a48777a7c2464cce3fca2694e0ae3","source":"build/generated/options-8.20.0.json"},"protocols":["dict","file","ftp","ftps","gopher","gophers","http","https","imap","imaps","ipfs","ipns","mqtt","mqtts","pop3","pop3s","rtsp","scp","sftp","smtp","smtps","telnet","tftp"],"resolverBackend":"c-ares","schemaVersion":"curl-runtime-profile/v1","sslBackend":"openssl"}},"schemaVersion":"curl-ir/v1"},"ok":true,"operations":[{"config":{"auth":{},"cookies":[],"customRequest":null,"headers":[],"httpVersion":null,"output":{"headerFile":null,"outputDir":null,"remoteNameAll":false},"postData":null,"postFields":"","proto":null,"protoDefault":null,"proxy":null,"proxyHeaders":[],"retry":{"count":0,"delayMs":0,"maxTimeMs":0},"timeouts":{"connectTimeoutMs":0,"expect100TimeoutMs":0,"happyEyeballsTimeoutMs":200,"maxTimeMs":0},"tls":{},"uploadFile":null,"userAgent":null,"userPwd":null},"index":0,"urls":[{"flags":{"noGlob":false,"outNull":false,"outSet":false,"uploadSet":false,"useRemote":false},"infile":null,"outfile":null,"url":"https://example.com","urlNumber":0}]}],"runtimeProfileApplied":{"compile":{"availableOptions":null,"defines":[],"disabledOptions":[]},"curlVersion":"8.20.0","defaults":{"followRedirects":false,"httpVersion":null,"userAgent":null},"features":["alt-svc","AsynchDNS","brotli","GSS-API","HSTS","HTTP2","HTTP3","HTTPS-proxy","IDN","IPv6","Kerberos","Largefile","libz","PSL","SPNEGO","SSL","threadsafe","TLS-SRP","UnixSockets","zstd"],"http3Backend":"ngtcp2","optionCatalog":{"curlVersion":"8.20.0","sha256":"413ecc7f3a2639a99e1f5a9dc5e121145c8a48777a7c2464cce3fca2694e0ae3","source":"build/generated/options-8.20.0.json"},"protocols":["dict","file","ftp","ftps","gopher","gophers","http","https","imap","imaps","ipfs","ipns","mqtt","mqtts","pop3","pop3s","rtsp","scp","sftp","smtp","smtps","telnet","tftp"],"resolverBackend":"c-ares","schemaVersion":"curl-runtime-profile/v1","sslBackend":"openssl"},"schemaVersion":"curl-parse-output/v1"}
