{"argv":["curl","sftp://example.com/file"],"curlSourceVersion":"8.20.0","diagnostics":[],"errors":[{"code":"protocol-not-available","detail":"sftp","option":null,"warning":false}],"events":[{"argvIndex":1,"canonical":null,"isNext":false,"isPositional":true,"negated":false,"operation":0,"rawFlag":"sftp://example.com/file","usedNextArg":false,"value":"sftp://example.com/file","valueArgvIndex":1}],"ir":{"command":{"argv":["curl","sftp://example.com/file"],"inputMode":"argv"},"curlSourceVersion":"8.20.0","diagnostics":[],"externalRefs":[],"globals":{},"groups":[{"id":"group-0","index":0,"options":{"headers":[]},"transfers":[{"effective":{"auth":{},"body":null,"cookies":[],"headers":[],"httpVersion":null,"method":{"source":"default","value":"GET"},"proxy":null,"tls":{}},"id":"transfer-0","index":0,"source":{"argvIndex":1,"end":23,"source":"argv","start":0},"url":"sftp://example.com/file"}]}],"runtime":{"profile":{"compile":{"availableOptions":null,"defines":[],"disabledOptions":[]},"curlVersion":"8.20.0","defaults":{"followRedirects":false,"httpVersion":null,"userAgent":null},"features":["SSL","HTTP2","HTTP3"],"http3Backend":"ngtcp2","optionCatalog":{"curlVersion":"8.20.0","sha256":"413ecc7f3a2639a99e1f5a9dc5e121145c8a48777a7c2464cce3fca2694e0ae3","source":"build/generated/options-8.20.0.json"},"protocols":["http","https"],"resolverBackend":"c-ares","schemaVersion":"curl-runtime-profile/v1","sslBackend":"openssl"}},"schemaVersion":"curl-ir/v1"},"ok":false,"operations":[{"config":{"auth":{},"cookies":[],"customRequest":null,"headers":[],"httpVersion":null,"output":{"headerFile":null,"outputDir":null,"remoteNameAll":false},"postData":null,"postFields":null,"proto":null,"protoDefault":null,"proxy":null,"proxyHeaders":[],"retry":{"count":0,"delayMs":0,"maxTimeMs":0},"timeouts":{"connectTimeoutMs":0,"expect100TimeoutMs":0,"happyEyeballsTimeoutMs":200,"maxTimeMs":0},"tls":{},"uploadFile":null,"userAgent":null,"userPwd":null},"index":0,"urls":[{"flags":{"noGlob":false,"outNull":false,"outSet":false,"uploadSet":false,"useRemote":false},"infile":null,"outfile":null,"url":"sftp://example.com/file","urlNumber":0}]}],"runtimeProfileApplied":{"compile":{"availableOptions":null,"defines":[],"disabledOptions":[]},"curlVersion":"8.20.0","defaults":{"followRedirects":false,"httpVersion":null,"userAgent":null},"features":["SSL","HTTP2","HTTP3"],"http3Backend":"ngtcp2","optionCatalog":{"curlVersion":"8.20.0","sha256":"413ecc7f3a2639a99e1f5a9dc5e121145c8a48777a7c2464cce3fca2694e0ae3","source":"build/generated/options-8.20.0.json"},"protocols":["http","https"],"resolverBackend":"c-ares","schemaVersion":"curl-runtime-profile/v1","sslBackend":"openssl"},"schemaVersion":"curl-parse-output/v1"}
